{
  "schema_version": "context-packet/v1",
  "tenant_id": "tenant-demo",
  "project_id": "project-01",
  "task_id": "task-01",
  "packet_id": "ctxpkt-0000000001",
  "policy_version": "policy-1.2",
  "repo_sha": "aaaaaaaaaaaaaaaaaaaaaaaaaaaaaaaaaaaaaaaa",
  "role": "critic",
  "strategy": "RECOVERABLE",
  "manifest_hash": "bbbbbbbbbbbbbbbbbbbbbbbbbbbbbbbbbbbbbbbbbbbbbbbbbbbbbbbbbbbbbbbb",
  "source_refs": [
    {
      "ref": "evref-000000000001",
      "sha256": "cccccccccccccccccccccccccccccccccccccccccccccccccccccccccccccccc",
      "source_kind": "git.diff",
      "required_original": true,
      "classification": "restricted"
    }
  ],
  "critical_assertions": [
    "Reviewer must inspect full original diff and all failing test assertions."
  ],
  "created_at": "2026-10-24T09:00:00Z",
  "usage": {
    "estimated_input_tokens": 1200,
    "measured": false
  }
}
